{
  "serviceId": "occupancy-certificate",
  "jurisdiction": "Bengaluru, Karnataka, India",
  "primaryScenarioId": "scenario_occupancy_certificate_sanctioned_residential",
  "asOf": "2026-09-06",
  "cells": {
    "cost": {
      "state": "mentioned",
      "claimCount": 1
    },
    "documents": {
      "state": "stated",
      "claimCount": 7
    },
    "eligibility": {
      "state": "stated",
      "claimCount": 1
    },
    "time": {
      "state": "stated",
      "claimCount": 2
    },
    "owner": {
      "state": "stated",
      "claimCount": 1
    },
    "after-submission": {
      "state": "stated",
      "claimCount": 3
    }
  },
  "statedCount": 5,
  "loginStrippedUnknownShare": 0,
  "portalFriction": {
    "deadLinkRate": 0.023255813953488372,
    "undated": true,
    "captcha": true,
    "jsOnly": false,
    "appOnly": false,
    "languages": [
      "English",
      "Kannada label present"
    ]
  },
  "auditFile": "research/audits/ind77-occupancy-certificate-audit.md",
  "benchmarkVersion": "0.1",
  "source": "authored"
}
