{
  "serviceId": "water-connection",
  "jurisdiction": "Hyderabad, Telangana, India",
  "primaryScenarioId": "scenario_ind32_water_residential",
  "asOf": "2026-09-06",
  "cells": {
    "cost": {
      "state": "stated",
      "claimCount": 17
    },
    "documents": {
      "state": "stated",
      "claimCount": 22
    },
    "eligibility": {
      "state": "stated",
      "claimCount": 10
    },
    "time": {
      "state": "stated",
      "claimCount": 18
    },
    "owner": {
      "state": "stated",
      "claimCount": 9
    },
    "after-submission": {
      "state": "stated",
      "claimCount": 8
    }
  },
  "statedCount": 6,
  "loginStrippedUnknownShare": 1,
  "portalFriction": null,
  "auditFile": "ledger/jurisdictions/hyderabad/audits/water-connection.md",
  "benchmarkVersion": "0.1",
  "source": "authored"
}
