{
  "serviceId": "birth-certificate",
  "jurisdiction": "Hyderabad, Telangana, India",
  "primaryScenarioId": "scenario_ind32_birth_copy_workflow",
  "asOf": "2026-09-06",
  "cells": {
    "cost": {
      "state": "stated",
      "claimCount": 1
    },
    "documents": {
      "state": "mentioned",
      "claimCount": 7
    },
    "eligibility": {
      "state": "stated",
      "claimCount": 6
    },
    "time": {
      "state": "stated",
      "claimCount": 3
    },
    "owner": {
      "state": "stated",
      "claimCount": 5
    },
    "after-submission": {
      "state": "stated",
      "claimCount": 6
    }
  },
  "statedCount": 5,
  "loginStrippedUnknownShare": 1,
  "portalFriction": null,
  "auditFile": "ledger/jurisdictions/hyderabad/audits/birth-certificate.md",
  "benchmarkVersion": "0.1",
  "source": "authored"
}
