{
  "serviceId": "water-connection",
  "jurisdiction": "Delhi, NCT of Delhi, India",
  "primaryScenarioId": "scenario_ind32_water_residential",
  "asOf": "2026-09-06",
  "cells": {
    "cost": {
      "state": "stated",
      "claimCount": 4
    },
    "documents": {
      "state": "stated",
      "claimCount": 3
    },
    "eligibility": {
      "state": "stated",
      "claimCount": 5
    },
    "time": {
      "state": "stated",
      "claimCount": 3
    },
    "owner": {
      "state": "stated",
      "claimCount": 3
    },
    "after-submission": {
      "state": "stated",
      "claimCount": 2
    }
  },
  "statedCount": 6,
  "loginStrippedUnknownShare": 1,
  "portalFriction": null,
  "auditFile": "ledger/jurisdictions/delhi/audits/water-connection.md",
  "benchmarkVersion": "0.1",
  "source": "authored"
}
