{
  "serviceId": "water-connection",
  "jurisdiction": "Mumbai, Maharashtra, India",
  "primaryScenarioId": "scenario_ind32_water_residential",
  "asOf": "2026-09-06",
  "cells": {
    "cost": {
      "state": "stated",
      "claimCount": 1
    },
    "documents": {
      "state": "stated",
      "claimCount": 3
    },
    "eligibility": {
      "state": "stated",
      "claimCount": 3
    },
    "time": {
      "state": "stated",
      "claimCount": 2
    },
    "owner": {
      "state": "stated",
      "claimCount": 3
    },
    "after-submission": {
      "state": "stated",
      "claimCount": 3
    }
  },
  "statedCount": 6,
  "loginStrippedUnknownShare": 1,
  "portalFriction": null,
  "auditFile": "ledger/jurisdictions/mumbai/audits/water-connection.md",
  "benchmarkVersion": "0.1",
  "source": "authored"
}
