{
  "serviceId": "birth-certificate",
  "jurisdiction": "Bengaluru, Karnataka, India",
  "primaryScenarioId": "scenario_ind32_birth_copy_workflow",
  "asOf": "2026-09-06",
  "cells": {
    "cost": {
      "state": "stated",
      "claimCount": 4
    },
    "documents": {
      "state": "stated",
      "claimCount": 1
    },
    "eligibility": {
      "state": "stated",
      "claimCount": 5
    },
    "time": {
      "state": "stated",
      "claimCount": 1
    },
    "owner": {
      "state": "stated",
      "claimCount": 8
    },
    "after-submission": {
      "state": "stated",
      "claimCount": 3
    }
  },
  "statedCount": 6,
  "loginStrippedUnknownShare": 1,
  "portalFriction": null,
  "auditFile": "ledger/jurisdictions/bengaluru-grid/audits/birth-certificate.md",
  "benchmarkVersion": "0.1",
  "source": "authored"
}
