{
  "serviceId": "building-plan",
  "jurisdiction": "Bengaluru, Karnataka, India",
  "primaryScenarioId": "scenario_building_w_suvarna",
  "asOf": "2026-08-31",
  "cells": {
    "cost": {
      "state": "mentioned",
      "claimCount": 0
    },
    "documents": {
      "state": "stated",
      "claimCount": 0
    },
    "eligibility": {
      "state": "mentioned",
      "claimCount": 0
    },
    "time": {
      "state": "stated",
      "claimCount": 0
    },
    "owner": {
      "state": "mentioned",
      "claimCount": 0
    },
    "after-submission": {
      "state": "mentioned",
      "claimCount": 0
    }
  },
  "statedCount": 2,
  "loginStrippedUnknownShare": 0.8333333333333334,
  "portalFriction": null,
  "auditFile": null,
  "benchmarkVersion": "0.1",
  "source": "reviewed-regex"
}
