{
  "serviceId": "sale-deed-registration",
  "jurisdiction": "Bengaluru, Karnataka, India",
  "primaryScenarioId": "scenario_sale_deed_bengaluru_residential",
  "asOf": "2026-09-05",
  "cells": {
    "cost": {
      "state": "mentioned",
      "claimCount": 4
    },
    "documents": {
      "state": "mentioned",
      "claimCount": 1
    },
    "eligibility": {
      "state": "stated",
      "claimCount": 1
    },
    "time": {
      "state": "mentioned",
      "claimCount": 1
    },
    "owner": {
      "state": "stated",
      "claimCount": 5
    },
    "after-submission": {
      "state": "mentioned",
      "claimCount": 4
    }
  },
  "statedCount": 2,
  "loginStrippedUnknownShare": 0.8571428571428571,
  "portalFriction": {
    "deadLinkRate": 0,
    "undated": false,
    "captcha": false,
    "jsOnly": true,
    "appOnly": false,
    "languages": []
  },
  "auditFile": "research/audits/ind78-sale-deed-registration-audit.md",
  "benchmarkVersion": "0.1",
  "source": "authored"
}
