{
  "serviceId": "water-connection",
  "jurisdiction": "Bengaluru, Karnataka, India",
  "primaryScenarioId": "scenario_ind32_water_residential",
  "asOf": "2026-09-06",
  "cells": {
    "cost": {
      "state": "mentioned",
      "claimCount": 17
    },
    "documents": {
      "state": "stated",
      "claimCount": 11
    },
    "eligibility": {
      "state": "stated",
      "claimCount": 3
    },
    "time": {
      "state": "mentioned",
      "claimCount": 2
    },
    "owner": {
      "state": "mentioned",
      "claimCount": 3
    },
    "after-submission": {
      "state": "stated",
      "claimCount": 9
    }
  },
  "statedCount": 3,
  "loginStrippedUnknownShare": 1,
  "portalFriction": null,
  "auditFile": "ledger/jurisdictions/bengaluru-grid/audits/water-connection.md",
  "benchmarkVersion": "0.1",
  "source": "authored"
}
